[
  {
    "id": "001",
    "slug": "fair-electoral-rolls-and-wrongful-exclusion",
    "title": "Fair electoral rolls and wrongful exclusion",
    "domainId": "d01",
    "raise": [
      "Voters",
      "migrants",
      "election observers"
    ],
    "answer": [
      "Electoral Registration Officer",
      "election authorities"
    ],
    "possibleChange": "Correct entries; publish review procedures and audit results",
    "evidence": [
      "Deletion notices",
      "appeals",
      "reversals",
      "roll audit"
    ],
    "challengeRoutes": [
      "A",
      "I",
      "P"
    ]
  },
  {
    "id": "002",
    "slug": "portable-and-accessible-voting",
    "title": "Portable and accessible voting",
    "domainId": "d01",
    "raise": [
      "Absent voters",
      "disabled voters",
      "carers"
    ],
    "answer": [
      "Election authorities",
      "lawmakers for legal changes"
    ],
    "possibleChange": "Authorised remote/postal access; accessible polling",
    "evidence": [
      "Journey costs",
      "failed journeys",
      "polling access audits"
    ],
    "challengeRoutes": [
      "A",
      "P",
      "J"
    ]
  },
  {
    "id": "003",
    "slug": "political-finance-transparency",
    "title": "Political finance transparency",
    "domainId": "d01",
    "raise": [
      "Citizens",
      "researchers",
      "parties"
    ],
    "answer": [
      "Election authorities",
      "relevant finance/enforcement bodies",
      "Parliament"
    ],
    "possibleChange": "Disclosure rules; lawful investigations; funding reform",
    "evidence": [
      "Disclosed contributions",
      "expenditure",
      "compliance records"
    ],
    "challengeRoutes": [
      "I",
      "V",
      "P"
    ]
  },
  {
    "id": "004",
    "slug": "public-corruption-and-bribery",
    "title": "Public corruption and bribery",
    "domainId": "d01",
    "raise": [
      "Service users",
      "workers",
      "protected informants"
    ],
    "answer": [
      "Department head",
      "competent vigilance or anti-corruption authority"
    ],
    "possibleChange": "Investigate allegations; repair controls; lawful disciplinary action",
    "evidence": [
      "Transaction records",
      "protected testimony",
      "inquiry findings"
    ],
    "challengeRoutes": [
      "V",
      "J"
    ]
  },
  {
    "id": "005",
    "slug": "procurement-and-public-contract-integrity",
    "title": "Procurement and public contract integrity",
    "domainId": "d01",
    "raise": [
      "Residents",
      "bidders",
      "workers",
      "auditors"
    ],
    "answer": [
      "Procuring authority",
      "oversight/audit bodies"
    ],
    "possibleChange": "Publish contract changes; investigate conflicts; improve procurement",
    "evidence": [
      "Tender criteria",
      "awards",
      "amendments",
      "delivery verification"
    ],
    "challengeRoutes": [
      "I",
      "V",
      "P"
    ]
  },
  {
    "id": "006",
    "slug": "local-government-powers-and-funding",
    "title": "Local-government powers and funding",
    "domainId": "d01",
    "raise": [
      "Residents",
      "panchayats",
      "ward groups"
    ],
    "answer": [
      "Local executive",
      "state local-government/finance departments"
    ],
    "possibleChange": "Devolve responsibilities; fund services; public budget hearings",
    "evidence": [
      "Mandates",
      "transfers",
      "spending",
      "service outcomes"
    ],
    "challengeRoutes": [
      "A",
      "I",
      "P"
    ]
  },
  {
    "id": "007",
    "slug": "federal-coordination-and-inter-state-accountability",
    "title": "Federal coordination and inter-state accountability",
    "domainId": "d01",
    "raise": [
      "Affected residents",
      "state institutions"
    ],
    "answer": [
      "Responsible Union/state departments",
      "intergovernmental forums"
    ],
    "possibleChange": "Joint action plans; clarify duties and dispute routes",
    "evidence": [
      "Unresolved referrals",
      "agreements",
      "implementation dates"
    ],
    "challengeRoutes": [
      "A",
      "P"
    ]
  },
  {
    "id": "008",
    "slug": "information-access-and-official-secrecy",
    "title": "Information access and official secrecy",
    "domainId": "d01",
    "raise": [
      "Citizens",
      "journalists",
      "researchers"
    ],
    "answer": [
      "Public authority PIO",
      "RTI appellate bodies"
    ],
    "possibleChange": "Disclose lawful records; improve proactive publication",
    "evidence": [
      "Request delays",
      "lawful exemptions",
      "appeal outcomes"
    ],
    "challengeRoutes": [
      "I",
      "J"
    ]
  },
  {
    "id": "009",
    "slug": "journalist-safety-and-editorial-independence",
    "title": "Journalist safety and editorial independence",
    "domainId": "d01",
    "raise": [
      "Journalists",
      "sources",
      "readers"
    ],
    "answer": [
      "Police for threats",
      "relevant public authorities",
      "media bodies within remit"
    ],
    "possibleChange": "Protect people; investigate threats; disclose state advertising policy",
    "evidence": [
      "Threat reports",
      "investigations",
      "advertising allocations"
    ],
    "challengeRoutes": [
      "H",
      "J",
      "I",
      "P"
    ]
  },
  {
    "id": "010",
    "slug": "media-ownership-misinformation-and-public-interest-debate",
    "title": "Media ownership, misinformation and public-interest debate",
    "domainId": "d01",
    "raise": [
      "Audiences",
      "researchers",
      "affected communities"
    ],
    "answer": [
      "Relevant information/competition authorities",
      "publishers",
      "legislatures"
    ],
    "possibleChange": "Ownership transparency; corrections; pluralism; lawful policy reform",
    "evidence": [
      "Ownership records",
      "correction logs",
      "ad transparency"
    ],
    "challengeRoutes": [
      "R",
      "P",
      "I"
    ]
  },
  {
    "id": "011",
    "slug": "police-complaints-and-refusal-to-register-offences",
    "title": "Police complaints and refusal to register offences",
    "domainId": "d02",
    "raise": [
      "Complainants",
      "witnesses",
      "authorised supporters"
    ],
    "answer": [
      "Station leadership",
      "supervisory police",
      "competent magistrate"
    ],
    "possibleChange": "Lawful registration/inquiry; reasoned decisions; supervision",
    "evidence": [
      "Complaint receipts",
      "refusal records",
      "follow-up actions"
    ],
    "challengeRoutes": [
      "A",
      "H",
      "J"
    ]
  },
  {
    "id": "012",
    "slug": "custodial-violence-and-deaths",
    "title": "Custodial violence and deaths",
    "domainId": "d02",
    "raise": [
      "Detainees",
      "families",
      "lawyers",
      "witnesses"
    ],
    "answer": [
      "Police/prison leadership",
      "competent investigating body"
    ],
    "possibleChange": "Protect people; preserve evidence; independent lawful investigation",
    "evidence": [
      "Medical records",
      "custody records",
      "inquiry findings"
    ],
    "challengeRoutes": [
      "H",
      "J"
    ]
  },
  {
    "id": "013",
    "slug": "court-delay-and-procedural-access",
    "title": "Court delay and procedural access",
    "domainId": "d02",
    "raise": [
      "Litigants",
      "lawyers",
      "researchers"
    ],
    "answer": [
      "Court administration",
      "justice departments for resources"
    ],
    "possibleChange": "Scheduling and staffing improvements; accessible filing",
    "evidence": [
      "Pendency by case type",
      "age",
      "vacancies",
      "waiting times"
    ],
    "challengeRoutes": [
      "P",
      "I",
      "J"
    ]
  },
  {
    "id": "014",
    "slug": "undertrial-detention-and-prison-conditions",
    "title": "Undertrial detention and prison conditions",
    "domainId": "d02",
    "raise": [
      "Prisoners",
      "families",
      "lawyers"
    ],
    "answer": [
      "Prison administration",
      "legal-services institutions",
      "competent courts"
    ],
    "possibleChange": "Legal assistance; bail review; healthcare and conditions",
    "evidence": [
      "Detention duration",
      "legal access",
      "inspections"
    ],
    "challengeRoutes": [
      "A",
      "H",
      "J"
    ]
  },
  {
    "id": "015",
    "slug": "affordable-legal-aid",
    "title": "Affordable legal aid",
    "domainId": "d02",
    "raise": [
      "Eligible people",
      "community organisations"
    ],
    "answer": [
      "District/state legal-services authorities"
    ],
    "possibleChange": "Assign counsel; explain eligibility; improve assistance",
    "evidence": [
      "Application outcomes",
      "counsel access",
      "client experience"
    ],
    "challengeRoutes": [
      "A",
      "J"
    ]
  },
  {
    "id": "016",
    "slug": "sexual-violence-and-survivor-centred-justice",
    "title": "Sexual violence and survivor-centred justice",
    "domainId": "d02",
    "raise": [
      "Survivors",
      "consented advocates",
      "clinicians"
    ],
    "answer": [
      "Police",
      "health services",
      "prosecution and support agencies"
    ],
    "possibleChange": "Protection, medical care, lawful investigation, support",
    "evidence": [
      "Private service-access records",
      "delay and attrition"
    ],
    "challengeRoutes": [
      "H",
      "J",
      "A"
    ]
  },
  {
    "id": "017",
    "slug": "communal-violence-and-hate-based-intimidation",
    "title": "Communal violence and hate-based intimidation",
    "domainId": "d02",
    "raise": [
      "Targeted communities",
      "witnesses",
      "residents"
    ],
    "answer": [
      "Police/district administration",
      "relevant rights bodies"
    ],
    "possibleChange": "Protection; impartial investigation; relief and prevention",
    "evidence": [
      "Incident verification",